{
  "pack": "ruqyah",
  "version": "1.0.1",
  "edition": "alquran-cloud:quran-uthmani",
  "segments": [
    {
      "id": "qaf-1-8",
      "surah": "سورة ق",
      "surahNumber": 50,
      "range": "الآيات ١ – ٨",
      "repeat": 1,
      "basmala": true,
      "ayahs": [
        {
          "number": 1,
          "text": "قٓ ۚ وَٱلْقُرْءَانِ ٱلْمَجِيدِ"
        },
        {
          "number": 2,
          "text": "بَلْ عَجِبُوٓا۟ أَن جَآءَهُم مُّنذِرٌۭ مِّنْهُمْ فَقَالَ ٱلْكَٰفِرُونَ هَٰذَا شَىْءٌ عَجِيبٌ"
        },
        {
          "number": 3,
          "text": "أَءِذَا مِتْنَا وَكُنَّا تُرَابًۭا ۖ ذَٰلِكَ رَجْعٌۢ بَعِيدٌۭ"
        },
        {
          "number": 4,
          "text": "قَدْ عَلِمْنَا مَا تَنقُصُ ٱلْأَرْضُ مِنْهُمْ ۖ وَعِندَنَا كِتَٰبٌ حَفِيظٌۢ"
        },
        {
          "number": 5,
          "text": "بَلْ كَذَّبُوا۟ بِٱلْحَقِّ لَمَّا جَآءَهُمْ فَهُمْ فِىٓ أَمْرٍۢ مَّرِيجٍ"
        },
        {
          "number": 6,
          "text": "أَفَلَمْ يَنظُرُوٓا۟ إِلَى ٱلسَّمَآءِ فَوْقَهُمْ كَيْفَ بَنَيْنَٰهَا وَزَيَّنَّٰهَا وَمَا لَهَا مِن فُرُوجٍۢ"
        },
        {
          "number": 7,
          "text": "وَٱلْأَرْضَ مَدَدْنَٰهَا وَأَلْقَيْنَا فِيهَا رَوَٰسِىَ وَأَنۢبَتْنَا فِيهَا مِن كُلِّ زَوْجٍۭ بَهِيجٍۢ"
        },
        {
          "number": 8,
          "text": "تَبْصِرَةًۭ وَذِكْرَىٰ لِكُلِّ عَبْدٍۢ مُّنِيبٍۢ"
        }
      ]
    },
    {
      "id": "qaf-9-14",
      "surah": "سورة ق",
      "surahNumber": 50,
      "range": "الآيات ٩ – ١٤",
      "repeat": 1,
      "basmala": false,
      "ayahs": [
        {
          "number": 9,
          "text": "وَنَزَّلْنَا مِنَ ٱلسَّمَآءِ مَآءًۭ مُّبَٰرَكًۭا فَأَنۢبَتْنَا بِهِۦ جَنَّٰتٍۢ وَحَبَّ ٱلْحَصِيدِ"
        },
        {
          "number": 10,
          "text": "وَٱلنَّخْلَ بَاسِقَٰتٍۢ لَّهَا طَلْعٌۭ نَّضِيدٌۭ"
        },
        {
          "number": 11,
          "text": "رِّزْقًۭا لِّلْعِبَادِ ۖ وَأَحْيَيْنَا بِهِۦ بَلْدَةًۭ مَّيْتًۭا ۚ كَذَٰلِكَ ٱلْخُرُوجُ"
        },
        {
          "number": 12,
          "text": "كَذَّبَتْ قَبْلَهُمْ قَوْمُ نُوحٍۢ وَأَصْحَٰبُ ٱلرَّسِّ وَثَمُودُ"
        },
        {
          "number": 13,
          "text": "وَعَادٌۭ وَفِرْعَوْنُ وَإِخْوَٰنُ لُوطٍۢ"
        },
        {
          "number": 14,
          "text": "وَأَصْحَٰبُ ٱلْأَيْكَةِ وَقَوْمُ تُبَّعٍۢ ۚ كُلٌّۭ كَذَّبَ ٱلرُّسُلَ فَحَقَّ وَعِيدِ"
        }
      ]
    },
    {
      "id": "qaf-15-22",
      "surah": "سورة ق",
      "surahNumber": 50,
      "range": "الآيات ١٥ – ٢٢",
      "repeat": 1,
      "basmala": false,
      "ayahs": [
        {
          "number": 15,
          "text": "أَفَعَيِينَا بِٱلْخَلْقِ ٱلْأَوَّلِ ۚ بَلْ هُمْ فِى لَبْسٍۢ مِّنْ خَلْقٍۢ جَدِيدٍۢ"
        },
        {
          "number": 16,
          "text": "وَلَقَدْ خَلَقْنَا ٱلْإِنسَٰنَ وَنَعْلَمُ مَا تُوَسْوِسُ بِهِۦ نَفْسُهُۥ ۖ وَنَحْنُ أَقْرَبُ إِلَيْهِ مِنْ حَبْلِ ٱلْوَرِيدِ"
        },
        {
          "number": 17,
          "text": "إِذْ يَتَلَقَّى ٱلْمُتَلَقِّيَانِ عَنِ ٱلْيَمِينِ وَعَنِ ٱلشِّمَالِ قَعِيدٌۭ"
        },
        {
          "number": 18,
          "text": "مَّا يَلْفِظُ مِن قَوْلٍ إِلَّا لَدَيْهِ رَقِيبٌ عَتِيدٌۭ"
        },
        {
          "number": 19,
          "text": "وَجَآءَتْ سَكْرَةُ ٱلْمَوْتِ بِٱلْحَقِّ ۖ ذَٰلِكَ مَا كُنتَ مِنْهُ تَحِيدُ"
        },
        {
          "number": 20,
          "text": "وَنُفِخَ فِى ٱلصُّورِ ۚ ذَٰلِكَ يَوْمُ ٱلْوَعِيدِ"
        },
        {
          "number": 21,
          "text": "وَجَآءَتْ كُلُّ نَفْسٍۢ مَّعَهَا سَآئِقٌۭ وَشَهِيدٌۭ"
        },
        {
          "number": 22,
          "text": "لَّقَدْ كُنتَ فِى غَفْلَةٍۢ مِّنْ هَٰذَا فَكَشَفْنَا عَنكَ غِطَآءَكَ فَبَصَرُكَ ٱلْيَوْمَ حَدِيدٌۭ"
        }
      ]
    },
    {
      "id": "qaf-23-29",
      "surah": "سورة ق",
      "surahNumber": 50,
      "range": "الآيات ٢٣ – ٢٩",
      "repeat": 7,
      "basmala": false,
      "ayahs": [
        {
          "number": 23,
          "text": "وَقَالَ قَرِينُهُۥ هَٰذَا مَا لَدَىَّ عَتِيدٌ"
        },
        {
          "number": 24,
          "text": "أَلْقِيَا فِى جَهَنَّمَ كُلَّ كَفَّارٍ عَنِيدٍۢ"
        },
        {
          "number": 25,
          "text": "مَّنَّاعٍۢ لِّلْخَيْرِ مُعْتَدٍۢ مُّرِيبٍ"
        },
        {
          "number": 26,
          "text": "ٱلَّذِى جَعَلَ مَعَ ٱللَّهِ إِلَٰهًا ءَاخَرَ فَأَلْقِيَاهُ فِى ٱلْعَذَابِ ٱلشَّدِيدِ"
        },
        {
          "number": 27,
          "text": "۞ قَالَ قَرِينُهُۥ رَبَّنَا مَآ أَطْغَيْتُهُۥ وَلَٰكِن كَانَ فِى ضَلَٰلٍۭ بَعِيدٍۢ"
        },
        {
          "number": 28,
          "text": "قَالَ لَا تَخْتَصِمُوا۟ لَدَىَّ وَقَدْ قَدَّمْتُ إِلَيْكُم بِٱلْوَعِيدِ"
        },
        {
          "number": 29,
          "text": "مَا يُبَدَّلُ ٱلْقَوْلُ لَدَىَّ وَمَآ أَنَا۠ بِظَلَّٰمٍۢ لِّلْعَبِيدِ"
        }
      ]
    },
    {
      "id": "qaf-30-37",
      "surah": "سورة ق",
      "surahNumber": 50,
      "range": "الآيات ٣٠ – ٣٧",
      "repeat": 1,
      "basmala": false,
      "ayahs": [
        {
          "number": 30,
          "text": "يَوْمَ نَقُولُ لِجَهَنَّمَ هَلِ ٱمْتَلَأْتِ وَتَقُولُ هَلْ مِن مَّزِيدٍۢ"
        },
        {
          "number": 31,
          "text": "وَأُزْلِفَتِ ٱلْجَنَّةُ لِلْمُتَّقِينَ غَيْرَ بَعِيدٍ"
        },
        {
          "number": 32,
          "text": "هَٰذَا مَا تُوعَدُونَ لِكُلِّ أَوَّابٍ حَفِيظٍۢ"
        },
        {
          "number": 33,
          "text": "مَّنْ خَشِىَ ٱلرَّحْمَٰنَ بِٱلْغَيْبِ وَجَآءَ بِقَلْبٍۢ مُّنِيبٍ"
        },
        {
          "number": 34,
          "text": "ٱدْخُلُوهَا بِسَلَٰمٍۢ ۖ ذَٰلِكَ يَوْمُ ٱلْخُلُودِ"
        },
        {
          "number": 35,
          "text": "لَهُم مَّا يَشَآءُونَ فِيهَا وَلَدَيْنَا مَزِيدٌۭ"
        },
        {
          "number": 36,
          "text": "وَكَمْ أَهْلَكْنَا قَبْلَهُم مِّن قَرْنٍ هُمْ أَشَدُّ مِنْهُم بَطْشًۭا فَنَقَّبُوا۟ فِى ٱلْبِلَٰدِ هَلْ مِن مَّحِيصٍ"
        },
        {
          "number": 37,
          "text": "إِنَّ فِى ذَٰلِكَ لَذِكْرَىٰ لِمَن كَانَ لَهُۥ قَلْبٌ أَوْ أَلْقَى ٱلسَّمْعَ وَهُوَ شَهِيدٌۭ"
        }
      ]
    },
    {
      "id": "qaf-38-45",
      "surah": "سورة ق",
      "surahNumber": 50,
      "range": "الآيات ٣٨ – ٤٥",
      "repeat": 1,
      "basmala": false,
      "ayahs": [
        {
          "number": 38,
          "text": "وَلَقَدْ خَلَقْنَا ٱلسَّمَٰوَٰتِ وَٱلْأَرْضَ وَمَا بَيْنَهُمَا فِى سِتَّةِ أَيَّامٍۢ وَمَا مَسَّنَا مِن لُّغُوبٍۢ"
        },
        {
          "number": 39,
          "text": "فَٱصْبِرْ عَلَىٰ مَا يَقُولُونَ وَسَبِّحْ بِحَمْدِ رَبِّكَ قَبْلَ طُلُوعِ ٱلشَّمْسِ وَقَبْلَ ٱلْغُرُوبِ"
        },
        {
          "number": 40,
          "text": "وَمِنَ ٱلَّيْلِ فَسَبِّحْهُ وَأَدْبَٰرَ ٱلسُّجُودِ"
        },
        {
          "number": 41,
          "text": "وَٱسْتَمِعْ يَوْمَ يُنَادِ ٱلْمُنَادِ مِن مَّكَانٍۢ قَرِيبٍۢ"
        },
        {
          "number": 42,
          "text": "يَوْمَ يَسْمَعُونَ ٱلصَّيْحَةَ بِٱلْحَقِّ ۚ ذَٰلِكَ يَوْمُ ٱلْخُرُوجِ"
        },
        {
          "number": 43,
          "text": "إِنَّا نَحْنُ نُحْىِۦ وَنُمِيتُ وَإِلَيْنَا ٱلْمَصِيرُ"
        },
        {
          "number": 44,
          "text": "يَوْمَ تَشَقَّقُ ٱلْأَرْضُ عَنْهُمْ سِرَاعًۭا ۚ ذَٰلِكَ حَشْرٌ عَلَيْنَا يَسِيرٌۭ"
        },
        {
          "number": 45,
          "text": "نَّحْنُ أَعْلَمُ بِمَا يَقُولُونَ ۖ وَمَآ أَنتَ عَلَيْهِم بِجَبَّارٍۢ ۖ فَذَكِّرْ بِٱلْقُرْءَانِ مَن يَخَافُ وَعِيدِ"
        }
      ]
    },
    {
      "id": "jinn-1-7",
      "surah": "سورة الجن",
      "surahNumber": 72,
      "range": "الآيات ١ – ٧",
      "repeat": 1,
      "basmala": true,
      "ayahs": [
        {
          "number": 1,
          "text": "قُلْ أُوحِىَ إِلَىَّ أَنَّهُ ٱسْتَمَعَ نَفَرٌۭ مِّنَ ٱلْجِنِّ فَقَالُوٓا۟ إِنَّا سَمِعْنَا قُرْءَانًا عَجَبًۭا"
        },
        {
          "number": 2,
          "text": "يَهْدِىٓ إِلَى ٱلرُّشْدِ فَـَٔامَنَّا بِهِۦ ۖ وَلَن نُّشْرِكَ بِرَبِّنَآ أَحَدًۭا"
        },
        {
          "number": 3,
          "text": "وَأَنَّهُۥ تَعَٰلَىٰ جَدُّ رَبِّنَا مَا ٱتَّخَذَ صَٰحِبَةًۭ وَلَا وَلَدًۭا"
        },
        {
          "number": 4,
          "text": "وَأَنَّهُۥ كَانَ يَقُولُ سَفِيهُنَا عَلَى ٱللَّهِ شَطَطًۭا"
        },
        {
          "number": 5,
          "text": "وَأَنَّا ظَنَنَّآ أَن لَّن تَقُولَ ٱلْإِنسُ وَٱلْجِنُّ عَلَى ٱللَّهِ كَذِبًۭا"
        },
        {
          "number": 6,
          "text": "وَأَنَّهُۥ كَانَ رِجَالٌۭ مِّنَ ٱلْإِنسِ يَعُوذُونَ بِرِجَالٍۢ مِّنَ ٱلْجِنِّ فَزَادُوهُمْ رَهَقًۭا"
        },
        {
          "number": 7,
          "text": "وَأَنَّهُمْ ظَنُّوا۟ كَمَا ظَنَنتُمْ أَن لَّن يَبْعَثَ ٱللَّهُ أَحَدًۭا"
        }
      ]
    },
    {
      "id": "jinn-8-13",
      "surah": "سورة الجن",
      "surahNumber": 72,
      "range": "الآيات ٨ – ١٣",
      "repeat": 1,
      "basmala": false,
      "ayahs": [
        {
          "number": 8,
          "text": "وَأَنَّا لَمَسْنَا ٱلسَّمَآءَ فَوَجَدْنَٰهَا مُلِئَتْ حَرَسًۭا شَدِيدًۭا وَشُهُبًۭا"
        },
        {
          "number": 9,
          "text": "وَأَنَّا كُنَّا نَقْعُدُ مِنْهَا مَقَٰعِدَ لِلسَّمْعِ ۖ فَمَن يَسْتَمِعِ ٱلْأٓنَ يَجِدْ لَهُۥ شِهَابًۭا رَّصَدًۭا"
        },
        {
          "number": 10,
          "text": "وَأَنَّا لَا نَدْرِىٓ أَشَرٌّ أُرِيدَ بِمَن فِى ٱلْأَرْضِ أَمْ أَرَادَ بِهِمْ رَبُّهُمْ رَشَدًۭا"
        },
        {
          "number": 11,
          "text": "وَأَنَّا مِنَّا ٱلصَّٰلِحُونَ وَمِنَّا دُونَ ذَٰلِكَ ۖ كُنَّا طَرَآئِقَ قِدَدًۭا"
        },
        {
          "number": 12,
          "text": "وَأَنَّا ظَنَنَّآ أَن لَّن نُّعْجِزَ ٱللَّهَ فِى ٱلْأَرْضِ وَلَن نُّعْجِزَهُۥ هَرَبًۭا"
        },
        {
          "number": 13,
          "text": "وَأَنَّا لَمَّا سَمِعْنَا ٱلْهُدَىٰٓ ءَامَنَّا بِهِۦ ۖ فَمَن يُؤْمِنۢ بِرَبِّهِۦ فَلَا يَخَافُ بَخْسًۭا وَلَا رَهَقًۭا"
        }
      ]
    },
    {
      "id": "jinn-14-21",
      "surah": "سورة الجن",
      "surahNumber": 72,
      "range": "الآيات ١٤ – ٢١",
      "repeat": 1,
      "basmala": false,